TITLE,A1,A2,JOURNAL,YEAR,AGE,Rank,H Count,IN PRESS,2002,2003,2004,2005,2006,2007,,2008,2009,2010,2011,2012,2013,2014,2015,2016,2017,2018,2019,2020,2021,2022,TOTAL,salt,salted,GOOGLE,Cites Per Year,C+12,R+12,H+12,C+24,R+24,H+24,C+24,R+24,H+36,>100,>100+12,>100+24,>100+36,*,H
Global urban population exposure to extreme heat,"Tuholske, C.","Caylor, K.K.",Proceedings of the National Academy of Sciences,2021,1,103,0,,,,,,,,,,,,,,,,,,,,,,5,2,7,0.3,7.3,,3.5,11,99,0,14,91,0,18,88,0,0,0,0,0,0,0
The salience of climate change in farmer decision-making within smallholder semi-arid agroecosystems,"Waldman, K","Attari, S.Z.",Climatic Change,2019,3,104,0,,,,,,,,,,,,,,,,,,,,0,2,5,0,7,0.4,7.4,5,1.8,9,103,0,11,103,0,12,103,0,0,0,0,0,0,0
An Ecohydrological Framework to Explain Shifts in Vegetation Organization Across Climatological Gradients,"Manfreda, S.","Caylor, K.K.",Ecohydrology,2017,5,105,0,,,,,,,,,,,,,,,,,,0,4,0,2,1,0,7,0.8,7.8,9,1.2,8,105,0,9,105,0,11,104,0,0,0,0,0,0,0
Improved removal of volatile organic compounds for laser-based spectroscopy of water isotopes.,"Chang, E.","Wolf, A",Rapid Communications in Mass Spectrometry,2016,6,106,0,,,,,,,,,,,,,,,,,0,3,1,0,1,2,0,7,0.7,7.7,8,1.0,8,106,0,9,106,0,10,106,0,0,0,0,0,0,0
Herbivores and mutualistic ants interact to regulate tree photosynthesis,"King, E.G.","Caylor, K.K.",New Phytologist,2010,12,107,0,0,,,,,,,,,,0,3,0,0,0,0,0,0,2,0,1,1,0,7,0.3,7.3,15,0.5,8,107,0,8,109,0,9,110,0,0,0,0,0,0,0
Pattern and process in savanna ecosystems,"Caylor, K.K.","Shugart, HH",Book Chapter,2006,16,108,0,,,,,,,,,1,5,0,0,0,0,1,0,0,0,0,0,0,0,0,7,0.2,7.2,,0.4,7,108,0,8,110,0,8,111,0,0,0,0,0,0,0
Farmer Forecasts: Impacts of Seasonal Rainfall Expectations on Agricultural Decision-Making in Sub-Saharan Africa,"Guido, Z.	Zimmer, A.",,Climate Risk Management,2020,2,109,0,,,,,,,,,,,,,,,,,,,,,0,5,0,5,0.0,5.0,,1.7,7,109,0,8,107,0,10,106,0,0,0,0,0,0,0
"Comparing measures of urban food security in Accra, Ghana","Tuholske, C.","Andam, K.",Environmental Research Letters,2020,2,110,0,,,,,,,,,,,,,,,,,,,,,2,2,1,5,0.3,5.3,5,1.7,7,109,0,8,107,0,10,106,0,0,0,0,0,0,0
A high-frequency mobile phone data collection approach for research in social-environmental systems: Applications in climate variability and food security in sub-Saharan Africa,"Giroux, S., ","Kouper, I.",Environmental Modelling & Software,2019,3,111,0,,,,,,,,,,,,,,,,,,,,1,1,3,0,5,0.3,5.3,5,1.3,6,111,0,8,111,0,9,109,0,0,0,0,0,0,0
Geographic Object-Based Image Analysis Framework for Mapping Vegetation Physiognomic Types at Fine Scales in Neotropical Savannas,"Ribeiro, F.","Roberts, D.A.",Remote Sensing,2020,2,112,0,,,,,,,,,,,,,,,,,,,,,1,2,1,4,0.3,4.3,2,1.3,5,112,0,7,112,0,8,112,0,0,0,0,0,0,0
Quantifying Transient Soil Moisture Dynamics Using Multipoint Direct-Current Resistivity in Homogeneous Sand,"Franz, TE","Nolan, J",Vadose Zone Journal,2011,11,113,0,0,,,,,,,,,,,2,0,1,1,0,0,0,0,0,0,0,0,4,0.8,4.8,6,0.3,4,113,0,5,113,0,5,114,0,0,0,0,0,0,0
Analytical expressions of variability in ecosystem structure and function obtained from three-dimensional stochastic vegetation modelling,"Good, S.P.","Rodriguez-Iturbe, I","Proceedings of the Royal Society, Series A",2013,9,114,0,0,,,,,,,,,,,,,0,0,1,0,1,0,0,1,0,0,3,0.3,3.3,4,0.3,3,114,0,4,115,0,4,116,0,0,0,0,0,0,0
Field-scale soil moisture bridges the spatial-scale gap between drought monitoring and agricultural yields,"Vergopolan, Noemi","Xiong, S.",Hydrology and Earth System Science,2021,1,115,0,,,,,,,,,,,,,,,,,,,,,,2,0,2,0.1,2.1,,1.0,3,115,0,4,114,0,5,113,0,0,0,0,0,0,0
Environmental heterogeneity and commodity sharing in smallholder agroecosystems,"Giroux, S.","McCord, P",PLoS ONE,2020,2,116,0,,,,,,,,,,,,,,,,,,,,,1,1,0,2,0.4,2.4,1,0.7,3,116,0,3,116,0,4,115,0,0,0,0,0,0,0
Direct Partitioning of Eddy-Covariance Water and Carbon Dioxide Fluxes into Ground and Plant Components,"Zahn, E.","Bou-Zeiud, E. ",Agriculture & Forest Meteorology,2022,0,117,0,,,,,,,,,,,,,,,,,,,,,,,,0,0.2,0.2,,0.0,0,117,0,0,117,0,0,117,0,0,0,0,0,0,0
Has the vision of a gender quota been realized for community-based water management committees in Kenya?,"Hannah, C.	Giroux, S.",,World Development,2021,1,118,0,,,,,,,,,,,,,,,,,,,,,,0,0,0,0.1,0.1,0,0.0,0,117,0,0,117,0,0,117,0,0,0,0,0,0,0
Mapping research topics at multiple levels of detail,"Lafia, S.","Kuhn, W.",Patterns,2021,1,119,0,,,,,,,,,,,,,,,,,,,,,,0,0,0,0.0,0.0,,0.0,0,117,0,0,117,0,0,117,0,0,0,0,0,0,0
Vegetation responses to climatic and geologic controls on water availability in Arizona,"Sabathier, R.	Singer, M.B.",,Environmental Research Letters,2021,1,120,0,,,,,,,,,,,,,,,,,,,,,,0,0,0,0.7,0.7,,0.0,0,117,0,0,117,0,0,117,0,0,0,0,0,0,0
Perceived Links between Climate Change and Weather Forecast Accuracy: New Barriers to Tools for Agricultural Decision-making,"Guido, Z.	Lopus, S.",,Climatic Change,2021,1,121,0,,,,,,,,,,,,,,,,,,,,,,0,0,0,0.0,0.0,,0.0,0,117,0,0,117,0,0,117,0,0,0,0,0,0,0
Consequences of dryland maize planting decisions under increased seasonal rainfall variability,"Krell, N.T.","Caylor, K.K.",Water Resources Research,2021,1,122,0,,,,,,,,,,,,,,,,,,,,,,0,0,0,0.9,0.9,,0.0,0,117,0,0,117,0,0,117,0,0,0,0,0,0,0
Effects of crack morphology on soil carbon flux dynamics in a dryland vertisol,"DeCarlo, K.","Caylor, K.K.",Geoderma,2020,2,123,0,,,,,,,,,,,,,,,,,,,,,0,0,0,0,0.7,0.7,1,0.0,0,117,0,0,117,0,0,117,0,0,0,0,0,0,0