TITLE,A1,A2,JOURNAL,YEAR,AGE,Rank,H Count,IN PRESS,2002,2003,2004,2005,2006,2007,,2008,2009,2010,2011,2012,2013,2014,2015,2016,2017,2018,2019,2020,2021,2022,TOTAL,salt,salted,GOOGLE,Cites Per Year,C+12,R+12,H+12,C+24,R+24,H+24,C+24,R+24,H+36,>100,>100+12,>100+24,>100+36,*,H
Determinants of woody cover in African savannas: A continental scale analysis,"Sankaran, M","Hanan, N",Nature,2005,17,1,1,0,,,,0,11,32,,50,61,67,71,84,78,69,72,101,95,104,95,90,83,20,1183,0.8,1183.8,"1,702",65.7,1249,1,1,1314,1,1,1380,1,1,1,1,1,1,1,1
Validation of SMAP surface soil moisture products with core validation sites,"Colliander, A","Jackson, TJ",Remote Sensing of Environment,2017,5,2,1,,,,,,,,,,,,,,,,,,22,69,87,85,70,23,356,0.4,356.4,369,59.3,415,2,1,475,2,1,534,2,1,1,1,1,1,1,2
On the Use of Unmanned Aerial Systems for Environmental Monitoring,"Manfreda, S.","McCabe, M.",Remote Sensing  ,2018,4,3,1,,,,,,,,,,,,,,,,,,,18,55,82,91,22,268,0.8,268.8,287,53.6,322,3,1,375,3,1,429,3,1,1,1,1,1,1,3
Positive feedbacks promote power-law clustering of Kalahari vegetation,"Scanlon, TM","Caylor, K.K.",Nature,2007,15,4,1,0,,,,,,2,,15,18,17,26,25,17,19,22,18,17,17,15,15,14,3,260,0.4,260.4,378,16.3,276,4,1,293,5,1,309,5,1,1,1,1,1,1,4
Photosynthetic seasonality of global tropical forests constrained by hydroclimate,"Guan, K.","Pan, M.",Nature Geoscience,2015,7,5,1,,,,,,,,,,,,,,,,5,25,24,39,42,31,57,17,240,0.5,240.5,247,30.0,270,5,1,300,4,1,330,4,1,1,1,1,1,1,5
Partitioning evapotranspiration across gradients of woody plant cover: assessment of a stable isotope technique,"Wang, L.","Caylor, K.K.",Geophysical Research Letters,2010,12,6,1,0,,,,,,,,,,3,2,13,10,12,8,12,17,33,36,23,17,7,193,0.5,193.5,179,14.8,208,6,1,223,7,1,238,7,1,1,1,1,1,1,6
Global synthesis of vegetation control on evapotranspiration partitioning,"Wang, L","Good, S.P.",Geophysical Research Letters,2014,8,7,1,,,,,,,,,,,,,,,1,10,13,19,32,32,32,36,11,186,0.1,186.1,191,20.7,207,7,1,227,6,1,248,6,1,1,1,1,1,1,7
Dryland ecohydrology and climate change: critical issues and technical advances ,"Wang, L","D'Odorico, P",Hydrology and Earth System Science,2012,10,8,1,0,,,,,,,,,,,,6,4,14,13,21,24,21,23,26,26,6,184,0.7,184.7,225,16.7,201,8,1,217,8,1,234,8,1,1,1,1,1,1,8
On soil moisture-vegetation feedbacks in dryland plant ecosystems,"D'Odorico, P","Caylor, K.K.",JGR - Biogeosciences,2007,15,9,1,0,,,,,,0,,2,7,7,8,15,14,13,13,10,19,19,21,14,16,3,181,0.8,181.8,285,11.3,192,9,1,204,9,1,215,9,1,1,1,1,1,1,9
Termite mounds can increase the robustness of dryland ecosystems to climatic change,"Bonachela, JA","Pringle, R.",Science,2015,7,10,1,,,,,,,,,,,,,,,,7,25,18,18,26,21,23,3,141,0.6,141.6,186,17.6,159,10,1,176,10,1,194,10,1,1,1,1,1,1,10
Trends in savanna structure and composition on an aridity gradient in the Kalahari,"Scholes, RJ","Dowty, PR",Journal of Vegetation Science,2002,20,11,1,0,0,6,11,9,5,5,,5,14,3,5,9,7,8,10,9,5,7,3,3,4,3,131,0.3,131.3,205,6.2,137,11,1,143,12,1,150,12,1,1,1,1,1,0,11
Determining land surface fractional cover from NDVI and rainfall time series for a savanna ecosystem,"Scanlon, TM","Albertson, JD",Remote Sensing of Environment,2002,20,12,1,0,0,4,4,7,7,4,,5,8,6,10,7,5,7,3,6,8,8,9,8,7,1,124,0.0,124.0,217,5.9,130,12,1,136,13,1,142,13,1,1,1,1,1,0,12
Climatological determinants of woody cover in Africa,"Good, SP","Caylor, K.K.",Proceedings of the National Academy of Sciences,2011,11,13,1,0,,,,,,,,,,,2,9,12,5,12,11,13,14,13,15,6,1,113,1.0,114.0,149,9.4,122,14,1,132,14,1,141,14,1,1,1,1,1,0,13
Measurements and Observations in the XXI century (MOXXI): innovation and multidisciplinarity to sense the hydrological cycle,"Flavia, T.","Selker, J.",Hydrological Sciences Journal,2018,4,14,1,,,,,,,,,,,,,,,,,,,23,24,37,18,3,105,0.8,105.8,116,21.0,126,13,1,147,11,1,168,11,1,1,1,1,1,1,14
Terrestrial hydrological controls on land surface phenology of African savannas and woodlands,"Guan, K.","Wood, E.F.",JGR - Biogeosciences,2014,8,15,1,,,,,,,,,,,,,,,1,4,8,21,14,14,18,9,3,92,0.7,92.7,107,10.2,102,15,1,112,15,1,123,15,1,0,1,1,1,0,15
Dynamic response of grass cover to rainfall variability: Implications for the function and persistence of savanna ecosystems,"Scanlon, TM","Caylor, K.K.",Advances in Water Resources,2005,17,16,1,0,,,,0,5,3,,9,9,8,1,3,6,8,5,6,4,4,1,3,5,3,83,0.9,83.9,119,4.6,88,16,1,92,17,1,97,17,1,0,0,0,0,0,16
On the coupled ecohydrological and geomorphological organization of river basins,"Caylor, K.K.","Manfreda, S.",Advances in Water Resources,2005,17,17,1,0,,,,0,5,4,,5,9,6,5,8,9,6,5,5,4,0,3,4,2,3,83,0.3,83.3,115,4.6,88,16,1,92,17,1,97,17,1,0,0,0,0,0,17
Understanding the role of ecohydrological feedbacks in ecosystem-state change in drylands,"Turnbull, L",,Ecohydrology,2012,10,18,1,0,,,,,,,,,,,,2,3,5,8,5,14,8,11,9,8,1,74,0.4,74.4,99,6.7,81,19,1,87,20,1,94,20,1,0,0,0,0,0,18
δ2H Isotopic flux partitioning of evapotranspiration over a grass field following a water pulse and subsequent dry down,"Good, S.P.","Soderberg, K.",Guan K.,2014,8,19,1,,,,,,,,,,,,,,,1,3,7,4,14,13,12,17,1,72,0.5,72.5,66,8.0,80,20,1,88,19,1,96,19,1,0,0,0,0,0,19
The Spatial and Temporal Domains of Modern Ecology,"Estes, L","Elsen, P.",Nature Ecology & Evolution,2018,4,20,1,,,,,,,,,,,,,,,,,,,6,18,28,17,0,69,0.5,69.5,84,13.8,83,18,1,97,16,1,110,16,1,0,0,0,1,1,20
Direct quantification of leaf transpiration isotopic composition,"Wang, L.","Good, SP",Agriculture & Forest Meteorology,2012,10,21,1,0,,,,,,,,,,,,5,4,4,9,6,5,9,6,10,6,2,66,0.6,66.6,79,6.0,72,21,1,78,21,1,84,21,1,0,0,0,0,0,21
"On the calibration of continuous, high-precision δ18O and δ2H measurements using an off-axis integrated cavity output spectrometer ","Wang, L","Caylor, K.K.",Rapid Communications in Mass Spectrometry,2009,13,22,1,0,,,,,,,,,0,9,7,13,3,2,4,5,7,3,3,4,4,2,66,0.9,66.9,77,4.7,71,22,1,75,22,1,80,22,1,0,0,0,0,0,22
On the ecohydrology of structurally heterogeneous semi-arid landscapes,"Caylor, K.K.","D'Odorico, P.",Water Resources Research,2006,16,23,1,0,,,,,2,4,,4,4,4,1,5,4,6,7,3,5,4,1,3,3,1,61,0.2,61.2,89,3.6,65,23,1,68,24,1,72,25,1,0,0,0,0,0,23
An ecohydrological approach to  predict regional species distribution patterns in dryland ecosystems,"Franz, TE","Caylor, K.K.",Advances in Water Resources,2010,12,24,1,0,,,,,,,,,,0,6,5,6,3,4,5,6,4,9,4,7,0,59,0.9,59.9,70,4.5,64,24,1,68,25,1,73,24,1,0,0,0,0,0,24
"Stable isotopes of water vapor in the vadose zone: A review of measurement and modeling techniques 
","Soderberg, K","Good, SP",Vadose Zone Journal,2012,10,25,1,0,,,,,,,,,,,,1,2,5,7,7,4,9,10,7,4,2,58,0.0,58.0,71,5.3,63,25,1,69,23,1,74,23,1,0,0,0,0,0,25
Tree spacing along the Kalahari transect in southern Africa,"Caylor, K.K.","Shugart, HH",Journal of Arid Environments,2003,19,26,1,0,,0,3,4,5,7,,3,4,5,3,6,5,3,3,1,2,2,0,1,0,,57,0.8,57.8,77,2.9,60,26,1,63,28,1,66,29,1,0,0,0,0,0,26
Soil moisture and plant stress dynamics along the Kalahari precipitation gradient,"Porporato, A","Laio, F",JGR - Atmospheres,2003,19,27,1,0,,1,3,4,1,4,,2,1,3,0,7,1,4,5,2,4,2,4,3,3,1,55,0.6,55.6,91,2.8,58,29,1,61,30,1,63,32,1,0,0,0,0,0,27
The effect of warming on grassland evapotranspiration partition using laser-based isotope monitoring techniques,"Wang, L","Nui, S.",Geochemica et Cosmochimica Acta,2013,9,28,1,0,,,,,,,,,,,,,0,6,4,7,8,5,6,10,6,2,54,0.3,54.3,61,5.4,59,27,1,65,26,1,70,26,1,0,0,0,0,0,28
Uncertainties in the assessment of the isotopic composition of surface fluxes: A direct comparison of techniques using laser‐based water vapor isotope analyzers,"Good, SP","Soderberg, K",JGR - Atmospheres,2012,10,29,1,0,,,,,,,,,,,,2,4,8,6,7,3,4,7,7,5,1,54,0.8,54.8,69,4.9,59,28,1,64,27,1,69,27,1,0,0,0,0,0,29
Ecohydrological optimization of pattern and process in dryland ecosystems: A tradeoff-based hypothesis,"Caylor, K.K.","Scanlon, TM",Water Resources Research,2009,13,30,1,0,,,,,,,,,0,3,4,4,11,4,5,4,5,3,5,2,3,0,53,0.8,53.8,79,3.8,57,30,1,61,29,1,64,30,1,0,0,0,0,0,30
Spatial heterogeneity and sources of soil carbon in Southern African savannas,"Wang, L","Okin, G.",Geoderma,2009,13,31,1,0,,,,,,,,,0,6,3,6,6,3,6,3,3,6,1,3,2,0,48,0.9,48.9,68,3.4,51,32,1,55,34,1,58,35,1,0,0,0,0,0,31
Explaining inter-annual variability of gross primary productivity from plant phenology and physiology,"Zhou, S.","Zhang, Z.",Agriculture & Forest Meteorology,2016,6,32,1,,,,,,,,,,,,,,,,,0,3,5,7,15,16,1,47,0.1,47.1,40,6.7,54,31,1,60,31,1,67,28,1,0,0,0,0,0,32
A generalized computer vision approach to mapping crop fields in heterogeneous agricultural landscapes,"Debats, SR","Dee, L.",Remote Sensing of Environment,2016,6,33,1,,,,,,,,,,,,,,,,,0,4,6,8,18,6,3,45,0.6,45.6,66,6.4,51,32,1,58,32,1,64,31,1,0,0,0,0,0,33
Using atmospheric trajectories to model the isotopic composition of rainfall in central Kenya,"Soderberg, K.","Good, S.P.",Ecosphere,2013,9,34,1,0,,,,,,,,,,,,,0,4,2,5,5,10,9,9,1,0,45,0.8,45.8,54,4.5,50,34,1,54,35,1,59,34,1,0,0,0,0,0,34
Dynamic interactions of ecohydrological and biogeochemical processes in water-limited systems,"Wang, L.","Manzoni, S.",Ecosphere,2015,7,35,1,,,,,,,,,,,,,,,,0,4,10,6,9,4,10,1,44,1.0,45.0,53,5.5,50,34,1,55,33,1,61,33,1,0,0,0,0,0,35
Multi-sensor derivation of regional vegetation fractional cover in Africa,"Guan, K","Wood, EF",Remote Sensing of Environment,2012,10,36,1,0,,,,,,,,,,,,0,1,8,1,7,7,3,5,5,4,2,43,0.4,43.4,50,3.9,47,36,1,51,36,1,55,36,1,0,0,0,0,0,36
Spatial variation in vegetation structure coupled to plant available water at landscape scales in a Brazilian savanna,"Ferira, J.","Bustamente, M",Oecologia,2007,15,37,1,0,,,,,,0,,1,1,1,6,0,1,3,4,7,3,2,2,7,4,0,42,0.4,42.4,57,2.6,45,37,1,47,37,1,50,37,1,0,0,0,0,0,37
Vegetation structure characteristics and relationships of Kalahari woodlands and savannas,"Privette, JP","Tian, Y",Global Change Biology,2004,18,38,1,0,,,2,1,5,3,,2,3,3,7,1,2,3,0,2,1,1,2,1,1,0,40,0.7,40.7,69,2.1,42,38,1,44,38,1,46,41,1,0,0,0,0,0,38
When is breeding for drought tolerance optimal when drought is random?,"Sambatti, J","Caylor, K.K.",New Phytologist,2007,15,39,1,0,,,,,,0,,3,1,4,3,5,4,3,4,2,2,1,2,1,4,0,39,0.1,39.1,59,2.4,41,39,1,44,39,1,46,42,1,0,0,0,0,0,39
Spatial patterns of soil nutrients in two southern African savannas,"Okin, GS","Mladenov, N",JGR - Biogeosciences,2008,14,40,0,0,,,,,,,,1,5,6,2,2,2,4,3,3,2,0,3,0,2,0,35,0.7,35.7,49,2.3,37,40,0,40,44,0,42,47,0,0,0,0,0,0,0
Tree canopy effects on simulated water stress in southern African savannas,"Caylor, K.K.","Shugart, HH",Ecosystems,2005,17,41,0,1,,,,0,1,1,,0,6,2,2,4,0,3,4,2,3,1,2,2,0,0,33,0.1,33.1,52,1.8,35,45,0,37,48,0,38,50,0,0,0,0,0,0,0
Dominant role of plant physiology in trend and variability of gross primary productivity in North America,"Zhou, S.","Zhang, Z.",Scientific Reports,2017,5,42,0,,,,,,,,,,,,,,,,,,5,1,9,8,9,0,32,0.3,32.3,28,5.3,37,40,0,43,41,1,48,40,1,0,0,0,0,0,0
A  simulation analysis of the detectability of understory burns in miombo woodlands,"Pereira, JMC","Mota, B",Remote Sensing of Environment,2004,18,43,0,0,,,0,1,3,2,,3,3,1,2,2,1,2,2,2,1,1,2,2,2,0,32,0.4,32.4,48,1.7,34,48,0,35,52,0,37,54,0,0,0,0,0,0,0
Dew deposition suppresses transpiration and carbon uptake in leaves,"Gerlein-Safdi, C","Koohafkan, MC",Agriculture & Forest Meteorology,2018,4,44,0,,,,,,,,,,,,,,,,,,,0,4,11,13,3,31,0.7,31.7,26,6.2,37,42,0,43,40,1,50,38,1,0,0,0,0,0,0
Community Water Governance on Mount Kenya: An Assessment Based on Ostrom's Design Principles of Natural Resource Management,"Dell’Angelo, J","McCord, P",Mountain Research & Development,2016,6,45,0,,,,,,,,,,,,,,,,,1,2,6,8,5,8,1,31,0.2,31.2,41,4.4,35,43,0,40,43,0,44,44,1,0,0,0,0,0,0
Warmer and wetter soil stimulates assimilation more than respiration in rainfed agricultural ecosystem on the China Loess Plateau: the role of partially plastic film mulching tillage,"Gong, D.","Hao, W.",PLoS ONE,2015,7,46,0,,,,,,,,,,,,,,,,0,0,11,5,6,7,2,0,31,0.3,31.3,33,3.9,35,44,0,39,45,0,43,46,0,0,0,0,0,0,0
Seasonal coupling of canopy structure and function in African tropical forests and its environmental controls,"Guan, K.","Wood, E.F.",Ecosphere,2013,9,47,0,0,,,,,,,,,,,,,0,3,1,4,9,2,3,4,4,1,31,0.3,31.3,34,3.1,34,46,0,37,47,0,40,48,0,0,0,0,0,0,0
"Decoupling structural and environmental determinants of sap velocity: Part II, Observational application","Dragoni, D","Caylor, K.K.",Agriculture & Forest Meteorology,2009,13,48,0,0,,,,,,,,,1,0,2,2,5,4,1,4,3,5,0,0,4,0,31,0.6,31.6,47,2.2,33,50,0,35,51,0,38,52,0,0,0,0,0,0,0
Feasible optimality of vegetation patterns in river basins,"Caylor, K.K.","Scanlon, TM",Geophysical Research Letters,2004,18,49,0,0,,,0,1,3,1,,1,6,1,1,2,4,3,1,1,1,1,1,2,1,0,31,0.5,31.5,50,1.6,33,51,0,34,54,0,36,58,0,0,0,0,0,0,0
The southern African Regional Science Initiative (SAFARI 2000): Wet season campaigns,"Otter, LB","Scholes, RJ",South African Journal of Science,2002,20,50,0,0,2,7,6,3,1,2,,3,0,0,0,1,1,1,0,3,0,0,0,1,0,0,31,0.5,31.5,32,1.5,32,52,0,34,55,0,35,59,0,0,0,0,0,0,0
Deriving vegetation phenological time and trajectory information over Africa using SEVIRI daily LAI,"Guan, K.","Medvigy, D.",IEEE Transactions on Geoscience and Remote Sensing,2014,8,51,0,0,,,,,,,,,,,,,0,2,1,3,3,5,7,5,3,1,30,0.8,30.8,32,3.3,33,49,0,37,48,0,40,49,0,0,0,0,0,0,0
Combined effect of soil moisture and nitrogen availability variations on grass productivity in African savannas,"Wang, L","D'Odorico, P",Plant & Soil,2010,12,52,0,0,,,,,,,,,,2,1,3,4,2,4,4,1,1,3,3,2,0,30,0.4,30.4,43,2.3,32,53,0,35,53,0,37,55,0,0,0,0,0,0,0
Comparison of ET partitioning and crop coefficients between partial plastic mulched and non -mulched maize fields,"Gong, D.","Mei, X.",Agricultural Water Management,2017,5,53,0,,,,,,,,,,,,,,,,,,2,5,5,7,10,0,29,0.4,29.4,27,4.8,34,47,0,39,46,0,43,45,0,0,0,0,0,0,0
Coupling vegetation organization patterns to soil resource heterogeneity in a central Kenyan dryland using geophysical imagery,"Franz, T.","King, E.G.",Water Resources Research,2011,11,54,0,0,,,,,,,,,,,0,5,1,2,4,1,4,3,5,3,1,0,29,0.2,29.2,34,2.4,31,55,0,34,56,0,36,57,0,0,0,0,0,0,0
On the importance of accurate depiction of infiltration processes on model soil moisture and vegetation water stress,"Manfreda, S.","Scanlon, TM",Ecohydrology,2010,12,55,0,0,,,,,,,,,,1,1,2,0,3,1,1,4,3,5,3,3,1,28,0.4,28.4,36,2.2,30,56,0,32,59,0,34,60,0,0,0,0,0,0,0
Evaluating ecohydrological theories of woody root distribution in the Kalahari,"Bhattachan, A",,PLoS ONE,2012,10,56,0,0,,,,,,,,,,,,2,3,1,5,2,3,1,1,4,4,0,26,0.7,26.7,37,2.4,28,59,0,31,63,0,33,63,0,0,0,0,0,0,0
Comparison of multi-level water use efficiency between plastic film partially mulched and non-mulched croplands at eastern Loess Plateau of China,"Gong, D.","Mei, X.",Agricultural Water Management,2017,5,57,0,,,,,,,,,,,,,,,,,,4,4,5,8,3,1,25,0.5,25.5,24,4.2,29,57,0,33,58,0,38,53,0,0,0,0,0,0,0
Carbon stable isotopes suggest that hippopotamus-vectored nutrients subsidize aquatic consumers in an East African river,"McCauley, D.J.","Dawson, T",Ecosphere,2015,7,58,0,,,,,,,,,,,,,,,,,3,2,6,3,6,5,0,25,0.9,25.9,27,3.1,28,60,0,31,61,0,34,61,0,0,0,0,0,0,0
Virtual water trade and development in Africa,"Konar, M","Caylor, K.K.",Hydrology and Earth System Science,2013,9,59,0,0,,,,,,,,,,,,,0,3,6,3,3,4,3,3,0,0,25,0.7,25.7,37,2.5,28,61,0,30,64,0,33,64,0,0,0,0,0,0,0
"Decoupling structural and environmental determinants of sap velocity: Part I, Theoretical development","Caylor, K.K.","Dragoni, D.",Agriculture & Forest Meteorology,2009,13,60,0,0,,,,,,,,,1,1,3,0,3,2,2,3,1,4,0,2,3,0,25,0.8,25.8,32,1.8,27,64,0,29,66,0,30,67,0,0,0,0,0,0,0
Smallholder farmers' use of mobile phone services in central Kenya,"Krell, N.T.","Girouz, S.A.",Climate and Development,2020,2,61,0,,,,,,,,,,,,,,,,,,,,,4,15,5,24,0.1,24.1,11,8.0,32,54,0,40,42,0,48,39,1,0,0,0,0,0,0
"A large‐area, spatially continuous assessment of land cover map error and its impact on downstream analyses","Estes, L.","Chen, P.",Global Change Biology,2018,4,62,0,,,,,,,,,,,,,,,,,,,2,12,9,1,0,24,0.9,24.9,28,4.8,29,58,0,34,57,0,38,51,0,0,0,0,0,0,0
"A platform for crowdsourcing the creation of representative, accurate landcover maps","Estes, L","McRitchie, D.",Environmental Modelling & Software,2016,6,63,0,,,,,,,,,,,,,,,,,1,2,6,6,6,2,1,24,0.7,24.7,32,3.4,27,62,0,31,62,0,34,62,0,0,0,0,0,0,0
Continental-scale impacts of intra-seasonal rainfall variability on simulated ecosystem responses in Africa,"Guan, K.","Good, S.P.",Biogeosciences,2014,8,64,0,,,,,,,,,,,,,,,0,2,1,2,5,5,5,3,1,24,0.1,24.1,31,2.7,27,65,0,29,65,0,32,65,0,0,0,0,0,0,0
Regional fuel load for two climatically contrasting years in southern Africa,"Hely, C","Dowty, PR",JGR - Atmospheres,2003,19,65,0,0,,1,3,4,1,2,,2,1,2,3,1,1,1,0,1,0,0,0,0,1,0,24,0.8,24.8,51,1.2,25,67,0,26,68,0,28,69,0,0,0,0,0,0,0
An ecohydrological approach to predicting hillslope-scale vegetation patterns in dryland ecosystems,"Franz, TE","Caylor, K.K.",Water Resources Research,2012,10,66,0,0,,,,,,,,,,,,3,3,5,2,3,3,0,3,0,0,0,22,0.5,22.5,70,2.0,24,69,0,26,69,0,28,68,0,0,0,0,0,0,0
Simulated productivity of heterogeneous patches in Southern African savanna landscapes using a canopy productivity model,"Caylor, K.K.","Shugart, HH",Landscape Ecology,2004,18,67,0,0,,,0,0,3,2,,3,1,2,1,0,2,0,0,1,0,4,1,1,1,0,22,0.5,22.5,31,1.2,23,70,0,24,72,0,25,75,0,0,0,0,0,0,0
A global database of water vapor isotopes measured with high temporal resolution infrared laser spectroscopy,"Wei, Zhongwang","Lee, Xuhui",Scientific Data,2019,3,68,0,,,,,,,,,,,,,,,,,,,,6,4,11,0,21,0.8,21.8,13,5.3,26,66,0,32,60,0,37,56,0,0,0,0,0,0,0
"Triple oxygen isotope composition of leaf waters in Mpala, central Kenya","Li, S.","Dennis, K.",Earth & Planetary Science Letters,2017,5,69,0,,,,,,,,,,,,,,,,,,0,4,3,0,13,1,21,0.6,21.6,17,3.5,25,68,0,28,67,0,32,66,0,0,0,0,0,0,0
"Ecohydrology in Practice: Strengths, Conveniences, and Opportunities","King, E.G.","Caylor, K.K.",Ecohydrology,2011,11,70,0,0,,,,,,,,,,,0,4,3,6,2,1,3,1,0,0,0,1,21,0.8,21.8,32,1.8,23,71,0,25,70,0,26,71,0,0,0,0,0,0,0
Ecosystem-scale spatial heterogeneity of stable isotopes of soil nitrogen in African savannas,"Wang, L.","Okin, GS",Landscape Ecology,2013,9,71,0,0,,,,,,,,,,,,0,3,1,3,4,1,4,0,0,3,1,20,0.1,20.1,21,2.0,22,72,0,24,73,0,26,73,0,0,0,0,0,0,0
Relationship between small-scale structural variability and simulated vegetation productivity across a regional moisture gradient in southern Africa,"Caylor, K.K.","Dowty, PR",Global Change Biology,2004,18,72,0,2,,,1,1,2,4,,2,2,1,1,1,0,0,1,1,0,1,0,1,1,0,20,0.1,20.1,33,1.1,21,74,0,22,76,0,23,77,0,0,0,0,0,0,0
"Reconciling agriculture, carbon and biodiversity in a savanna transformation frontier","Estes, L.","Searchinger, T.",Philosophical Transactions of the Royal Society B - Biological Sciences,2016,6,73,0,,,,,,,,,,,,,,,,,1,1,4,2,5,5,1,19,1.0,20.0,22,2.7,22,73,0,24,71,0,27,70,0,0,0,0,0,0,0
Nutrient limitation on above-ground grass production in four savanna types along the Kalahari Transect,"Ries-O’Halloran, L","Shugart, HH",Journal of Arid Environments,2010,12,74,0,0,,,,,,,,,,0,1,2,1,0,4,1,1,1,3,2,3,0,19,0.1,19.1,24,1.5,20,75,0,22,77,0,23,76,0,0,0,0,0,0,0
Deforestation-induced warming over tropical mountain regions regulated by elevation,"Zeng, Z.","Wang, D.",Nature Geoscience,2021,1,75,0,,,,,,,,,,,,,,,,,,,,,,12,6,18,0.8,18.8,0,9.0,27,63,0,36,50,0,45,43,1,0,0,0,0,0,0
"Simulated sensitivity of African terrestrial ecosystem photosynthesis to rainfall frequency, intensity, and rainy season length","Guan, K.","Good, S.P.",Environmental Research Letters,2018,4,76,0,,,,,,,,,,,,,,,,,,,2,2,5,6,1,16,0.6,16.6,13,3.2,19,76,0,22,75,0,26,74,0,0,0,0,0,0,0
A quantitative description of the interspecies diversity of belowground structure in savanna woody plants,"O’Donnell, FC","Caylor, K.K.",Ecosphere,2015,7,77,0,,,,,,,,,,,,,,,,0,0,1,3,2,4,5,1,16,0.1,16.1,12,2.0,18,78,0,20,78,0,22,79,0,0,0,0,0,0,0
"Ecohydrological interactions in a two-phase mosaic dryland: implications for regime shifts, resilience, and restoration","King, E.G.","Franz, TE",Ecohydrology,2012,10,78,0,0,,,,,,,,,,,,1,1,2,1,1,1,2,3,2,2,0,16,0.6,16.6,26,1.5,17,79,0,19,80,0,20,80,0,0,0,0,0,0,0
Cognitive biases about climate variability in smallholder farming systems in Zambia,"Waldman, K","Vergopolan, N.","Weather, Climate & Society",2019,3,79,0,,,,,,,,,,,,,,,,,,,,1,5,9,0,15,0.1,15.1,12,3.8,19,77,0,23,74,0,26,71,0,0,0,0,0,0,0
Characterizing ecohydrological and biogeochemical connectivity across multiple scales: a new conceptual framework,"Wang, L.","Zou, C.",Ecohydrology,2012,10,80,0,0,,,,,,,,,,,,4,0,1,1,1,3,2,0,2,1,0,15,0.1,15.1,24,1.4,16,80,0,18,81,0,19,83,0,0,0,0,0,0,0
On The Vulnerability of Water Limited Ecosystems to Climate Change,"Manfreda, S.","Caylor, K.K.",Water,2013,9,81,0,0,,,,,,,,,,,,,1,1,3,1,4,2,1,1,0,0,14,0.0,14.0,21,1.4,15,82,0,17,82,0,18,85,0,0,0,0,0,0,0
Metabolic principles of river basin organization,"Rodriguez-Iturbe, I","Caylor, K.K.",Proceedings of the National Academy of Sciences,2011,11,82,0,0,,,,,,,,,,,0,2,3,2,1,2,1,1,1,1,0,0,14,0.1,14.1,24,1.2,15,83,0,16,85,0,18,87,0,0,0,0,0,0,0
Variability in urban population distributions across Africa,"Tuholske, C.","Caylor, K.K.",Environmental Research Letters,2019,3,83,0,,,,,,,,,,,,,,,,,,,,0,2,10,1,13,0.7,13.7,2,3.3,16,81,0,20,79,0,23,78,0,0,0,0,0,0,0
"Global patterns of the contributions of storm frequency, intensity, and seasonality to inter-annual variability of precipitation","Good, S.P.","Guan, K.",Journal of Climate,2016,6,84,0,,,,,,,,,,,,,,,,,0,4,4,3,1,1,0,13,0.9,13.9,14,1.9,15,84,0,17,83,0,19,84,0,0,0,0,0,0,0
A temporally explicit Production Efficiency Model for fuel load allocation in southern Africa,"Hely, C","Caylor, K.K.",Ecosystems,2007,15,85,0,0,,,,,,0,,0,1,2,1,1,3,1,0,1,1,0,1,0,1,0,13,1.0,14.0,23,0.8,14,85,0,15,90,0,15,93,0,0,0,0,0,0,0
Household-level heterogeneity of water resources within common-pool resource systems,"McCord, P.","Dell’Angelo, J.",Ecology and Society,2017,5,86,0,,,,,,,,,,,,,,,,,,1,3,2,3,2,0,11,0.1,11.1,17,1.8,13,87,0,15,88,0,16,89,0,0,0,0,0,0,0
Calibration of a parsimonious distributed ecohydrological daily model in a data-scarce basin using exclusively the spatio-temporal variation of NDVI,"Ruiz-Perez, G.","Koch, J.",Hydrology and Earth System Science,2017,5,87,0,,,,,,,,,,,,,,,,,,0,1,4,2,2,2,11,0.8,11.8,14,1.8,13,87,0,15,88,0,16,89,0,0,0,0,0,0,0
Soil organic C and total N pools in the Kalahari: potential impacts of climate change on C sequestration in savannas,"Dintwe, K.","Okin, GS",Plant & Soil,2015,7,88,0,,,,,,,,,,,,,,,,0,1,1,6,2,1,0,0,11,0.2,11.2,20,1.4,12,89,0,14,92,0,15,94,0,0,0,0,0,0,0
"Changing water availability during the Arican maize-growing season, 1979-2010","Estes, L","Chaney, N.",Environmental Research Letters,2014,8,89,0,,,,,,,,,,,,,,,0,0,3,2,1,3,2,0,0,11,0.5,11.5,20,1.2,12,90,0,13,94,0,15,96,0,0,0,0,0,0,0
"An analysis of structure: biomass structure relationships for characteristic species of the western Kalahari, Botswana","Meyer, T","D’Odorico, P",Journal of African Ecology,2013,9,90,0,0,,,,,,,,,,,,,,0,0,1,1,2,2,1,4,0,11,0.0,11.0,15,1.1,12,91,0,13,97,0,14,97,0,0,0,0,0,0,0
A model-based evaluation of woody plant encroachment impacts on coupled carbon and water cycles,"O’Donnell, FC","Caylor, K.K.",JGR - Biogeosciences,2012,10,91,0,0,,,,,,,,,,,,0,1,1,2,1,0,1,3,0,2,0,11,0.2,11.2,13,1.0,12,92,0,13,98,0,14,98,0,0,0,0,0,0,0
Release of gaseous and particulate carbonaceous compounds from biomass burning during the SAFARI 2000 dry season field campaign,"Hely, C","Caylor, K.K.",JGR - Atmospheres,2003,19,92,0,0,,1,2,3,0,2,,2,1,0,0,0,0,0,0,0,0,0,0,0,0,0,11,0.5,11.5,17,0.6,12,96,0,12,99,0,13,102,0,0,0,0,0,0,0
"Accounting for training data error in machine learning applied to 
Earth observations","Elmes, A.","Alemohammad, H.",Remote Sensing,2020,2,93,0,,,,,,,,,,,,,,,,,,,,,1,8,1,10,0.3,10.3,9,3.3,13,86,0,17,84,0,20,82,0,0,0,0,0,0,0
Leaf water 18O and 2H maps show directional enrichment discrepancy in Colocasia esculenta,"Gerlein-Safdi, C","Gauthier, P.",Plant Cell and Environment,2017,5,94,0,,,,,,,,,,,,,,,,,,0,1,1,3,5,0,10,0.8,10.8,9,1.7,12,95,0,13,95,0,15,95,0,0,0,0,0,0,0
Climate sensitivity of water use by riparian woodlands at landscape scales,"Mayes, M.","Caylor, K.K.",Hydrological Processes,2020,2,95,0,,,,,,,,,,,,,,,,,,,,,0,8,1,9,0.5,9.5,0,3.0,12,92,0,15,87,0,18,86,0,0,0,0,0,0,0
Biophysical effects on soil crack morphology in a faunally active dryland vertisol,"DeCarlo, K.","Caylor, K.K.",Geoderma,2019,3,96,0,,,,,,,,,,,,,,,,,,,,1,3,5,0,9,0.5,9.5,4,2.3,11,97,0,14,93,0,16,92,0,0,0,0,0,0,0
Modeling ecohydrological dynamics of smallholder strategies for food production in dryland agricultural systems,"Gower, D.B.","Dell’Angelo, J.",Environmental Research Letters,2016,6,97,0,,,,,,,,,,,,,,,,,0,2,3,0,3,1,0,9,0.9,9.9,12,1.3,10,100,0,12,100,0,13,99,0,0,0,0,0,0,0
Challenges and opportunities in precision irrigation decision-support systems for center pivots ,"Zhang, J.	Guan, K.",,Environmental Research Letters,2021,1,98,0,,,,,,,,,,,,,,,,,,,,,,5,3,8,0.5,8.5,,4.0,12,92,0,16,86,0,20,81,0,0,0,0,0,0,0
Dynamics of population growth in secondary cities across southern Africa,"Zimmer, A.","Guido, Z.",Landscape Ecology,2020,2,99,0,,,,,,,,,,,,,,,,,,,,,2,4,2,8,0.7,8.7,2,2.7,11,98,0,13,95,0,16,91,0,0,0,0,0,0,0
Comparing empirical and survey-based yield forecasts in a dryland agro-ecosystem,"Zhao, Y.","Vergopolan, N.",Agriculture & Forest Meteorology,2018,4,100,0,,,,,,,,,,,,,,,,,,,0,2,5,1,0,8,0.2,8.2,10,1.6,10,101,0,11,101,0,13,100,0,0,0,0,0,0,0
Dew-induced transpiration suppression impacts the water and isotope balances of Colocasia leaves,"Gerlein-Safdi, C","Gauthier, P.G.",Oecologia,2018,4,101,0,,,,,,,,,,,,,,,,,,,0,2,2,4,0,8,0.2,8.2,12,1.6,10,101,0,11,101,0,13,100,0,0,0,0,0,0,0
Reframing hydrology education to solve coupled human and environmental problems,"King, E.G.","O’Donnell, F.",Hydrology and Earth System Science,2012,10,102,0,0,,,,,,,,,,,,0,1,0,1,0,0,0,2,2,2,0,8,0.8,8.8,20,0.7,9,104,0,9,104,0,10,105,0,0,0,0,0,0,0
