TITLE,A1,A2,JOURNAL,YEAR,AGE,Rank,H Count,IN PRESS,2002,2003,2004,2005,2006,2007,,2008,2009,2010,2011,2012,2013,2014,2015,2016,2017,2018,2019,2020,2021,TOTAL,salt,salted,GOOGLE,Cites Per Year,C+12,R+12,H+12,C+24,R+24,H+24,C+24,R+24,H+36,>100,>100+12,>100+24,>100+36,*,H
Variability in urban population distributions across Africa,"Tuholske, C.","Caylor, K.K.",Environmental Research Letters,2019,2,104,0,,,,,,,,,,,,,,,,,,,,0,2,3,5,0.7,5.7,2,1.7,7,103,0,8,101,0,10,99,0,0,0,0,0,0,0
Quantifying Transient Soil Moisture Dynamics Using Multipoint Direct-Current Resistivity in Homogeneous Sand,"Franz, TE","Nolan, J",Vadose Zone Journal,2011,10,105,0,0,,,,,,,,,,,2,0,1,1,0,0,0,0,0,0,0,4,0.1,4.1,6,0.4,4,109,0,5,109,0,5,109,0,0,0,0,0,0,0
Deforestation-induced warming over tropical mountain regions regulated by elevation,"Zeng, Z.","Wang, D.",Nature Geoscience,2021,0,106,0,,,,,,,,,,,,,,,,,,,,,,3,3,0.2,3.2,0,3.0,6,105,0,9,98,0,12,97,0,0,0,0,0,0,0
Geographic Object-Based Image Analysis Framework for Mapping Vegetation Physiognomic Types at Fine Scales in Neotropical Savannas,"Ribeiro, F.","Roberts, D.A.",Remote Sensing,2020,1,107,0,,,,,,,,,,,,,,,,,,,,,1,2,3,0.4,3.4,2,1.5,5,107,0,6,107,0,8,107,0,0,0,0,0,0,0
Climate sensitivity of water use by riparian woodlands at landscape scales,"Mayes, M.","Caylor, K.K.",Hydrological Processes,2020,1,108,0,,,,,,,,,,,,,,,,,,,,,0,5,5,0.4,5.4,0,2.5,8,99,0,10,97,0,13,95,0,0,0,0,0,0,0
Dynamics of population growth in secondary cities across southern Africa,"Zimmer, A.","Guido, Z.",Landscape Ecology,2020,1,109,0,,,,,,,,,,,,,,,,,,,,,2,1,3,0.6,3.6,2,1.5,5,107,0,6,107,0,8,107,0,0,0,0,0,0,0
Analytical expressions of variability in ecosystem structure and function obtained from three-dimensional stochastic vegetation modelling,"Good, S.P.","Rodriguez-Iturbe, I","Proceedings of the Royal Society, Series A",2013,8,110,0,0,,,,,,,,,,,,,0,0,1,0,1,0,0,1,0,3,0.5,3.5,4,0.3,3,110,0,4,112,0,4,112,0,0,0,0,0,0,0
"Comparing measures of urban food security in Accra, Ghana","Tuholske, C.","Andam, K.",Environmental Research Letters,2020,1,111,0,,,,,,,,,,,,,,,,,,,,,2,0,2,0.2,2.2,5,1.0,3,111,0,4,110,0,5,110,0,0,0,0,0,0,0
Environmental heterogeneity and commodity sharing in smallholder agroecosystems,"Giroux, S.","McCord, P",PLoS ONE,2020,1,112,0,,,,,,,,,,,,,,,,,,,,,1,1,2,0.7,2.7,1,1.0,3,111,0,4,110,0,5,110,0,0,0,0,0,0,0
Farmer Forecasts: Impacts of Seasonal Rainfall Expectations on Agricultural Decision-Making in Sub-Saharan Africa,,,,,2021,113,0,,,,,,,,,,,,,,,,,,,,,0,1,1,0.2,1.2,,0.0,1,113,0,1,113,0,1,113,0,0,0,0,0,0,0
Has the vision of a gender quota been realized for community-based water management committees in Kenya?,"Hannah, C.	Giroux, S.",,World Development,2021,0,114,0,,,,,,,,,,,,,,,,,,,,,,0,0,0.7,0.7,0,0.0,0,114,0,0,114,0,0,114,0,0,0,0,0,0,0
Effects of crack morphology on soil carbon flux dynamics in a dryland vertisol,"DeCarlo, K.","Caylor, K.K.",Geoderma,2020,1,115,0,,,,,,,,,,,,,,,,,,,,,0,0,0,0.9,0.9,1,0.0,0,114,0,0,114,0,0,114,0,0,0,0,0,0,0
Challenges and opportunities in precision irrigation decision-support systems for center pivots ,,,,,2021,116,0,,,,,,,,,,,,,,,,,,,,,0,0,0,0.6,0.6,,0.0,0,114,0,0,114,0,0,114,0,0,0,0,0,0,0
Field-scale soil moisture bridges the spatial-scale gap between drought monitoring and agricultural yields,,,,,2021,117,0,,,,,,,,,,,,,,,,,,,,,0,0,0,0.1,0.1,,0.0,0,114,0,0,114,0,0,114,0,0,0,0,0,0,0